{
  "id": "6293d2b3-5fde-4bf0-8b69-14734283f7bd",
  "sourceID": "shardId-000000000000:49620770030960603994186530106341665232583331965449535490",
  "source": "aws:kinesis:record",
  "eventType": "Personal.BlogPost.Update",
  "content": {},
  "metadata": {
    "timestamp": 112904812049,
    "sourceURI": "arn:aws:kinesis:us-east-1:142037127835:stream/bigboidefaultkinesis-dev",
    "visibility": "public",
    "sourceMessage": {},
    "additionalData": {},
    "isValid": false
  },
  "publishInfo": {
    "icon": {
      "type": "Icon",
      "value": "info"
    },
    "subject": "Dat",
    "subjectLink": "https://www.dat.do",
    "action": "just updated",
    "target": "his blog post",
    "targetLink": "https://www.test.com/",
    "message": "Dat just updated his blog post"
  }
}
